{"id":"COS-MES-002","type":"cosmology","title":"Tiamat","status":"active","version":"1.0.0","tradition":"Babylonian Enuma Elish","description":"Tiamat is the female saltwater principle in Enuma Elish and becomes central to the epic's conflict and cosmic ordering.","text_ids":["TXT-MES-001"],"civilization_ids":["CIV-MES-001"],"region_ids":["REG-MES-001"],"element_type":"saltwater deity/principle","source_ids":[],"evidence_ids":[],"notes":"The role recorded here belongs to Enuma Elish and should not be generalized to all Mesopotamian cosmologies."}