{"id":"COS-GRC-001","type":"cosmology","title":"Gaia","status":"active","version":"1.0.0","tradition":"Hesiodic Greek theogony","description":"Gaia is Earth, presented in Hesiod's Theogony as one of the primordial beings.","text_ids":["TXT-GRC-001"],"civilization_ids":["CIV-GRC-001"],"region_ids":["REG-AEG-001"],"element_type":"earth primordial","source_ids":[],"evidence_ids":[],"notes":"The record captures the literary role in the Theogony."}