{"id":"COS-GEN-002","type":"cosmology","title":"Firmament","status":"active","version":"1.0.0","tradition":"Genesis 1","description":"Genesis 1 presents a firmament associated with the division of waters and later names it heaven.","text_ids":["TXT-GEN-001"],"civilization_ids":[],"region_ids":["REG-LEV-001"],"element_type":"firmament / expanse","source_ids":[],"evidence_ids":[],"notes":"A hydraulic or dam interpretation is a GEI interpretation, not a definition supplied by the text itself."}