{"id":"COS-GEN-001","type":"cosmology","title":"The Deep","status":"active","version":"1.0.0","tradition":"Genesis 1","description":"The Hebrew Bible's Genesis 1:2 describes darkness over the face of the deep before the subsequent ordering sequence.","text_ids":["TXT-GEN-001"],"civilization_ids":[],"region_ids":["REG-LEV-001"],"element_type":"primordial waters / deep","source_ids":[],"evidence_ids":[],"notes":"GEI may interpret this structurally, but that interpretation is separate from the textual observation."}