{"id":"COS-GRC-003","type":"cosmology","title":"Oceanus","status":"active","version":"1.0.0","tradition":"Greek mythic tradition","description":"Oceanus is the Titan associated with the great encircling stream or world-ocean in Greek mythic tradition.","text_ids":["TXT-GRC-001"],"civilization_ids":["CIV-GRC-001"],"region_ids":["REG-AEG-001"],"element_type":"cosmic water / river","source_ids":[],"evidence_ids":[],"notes":"Oceanus should not be treated as identical to a primordial ocean in every Greek source."}