{"id":"COS-EGY-003","type":"cosmology","title":"Nut","status":"active","version":"1.0.0","tradition":"Heliopolitan Egyptian creation tradition","description":"Nut is the sky goddess in the Heliopolitan divine genealogy and is commonly represented as separated from Geb.","text_ids":["TXT-EGY-001"],"civilization_ids":["CIV-EGY-001"],"region_ids":["REG-NIL-001"],"element_type":"sky deity","source_ids":[],"evidence_ids":[],"notes":"The sky-earth relationship is recorded as a comparative feature, not proof of textual dependence."}