{"id":"COS-EGY-002","type":"cosmology","title":"Geb","status":"active","version":"1.0.0","tradition":"Heliopolitan Egyptian creation tradition","description":"Geb is the earth deity in the Heliopolitan divine genealogy and is associated with the earth beneath Nut.","text_ids":["TXT-EGY-001"],"civilization_ids":["CIV-EGY-001"],"region_ids":["REG-NIL-001"],"element_type":"earth deity","source_ids":[],"evidence_ids":[],"notes":"This record describes the traditional role; it does not assert a direct structural equivalence with Genesis earth."}