{"id":"COS-GRC-002","type":"cosmology","title":"Ouranos","status":"active","version":"1.0.0","tradition":"Hesiodic Greek theogony","description":"Ouranos is Heaven/Sky in Hesiod's Theogony and is paired genealogically with Gaia.","text_ids":["TXT-GRC-001"],"civilization_ids":["CIV-GRC-001"],"region_ids":["REG-AEG-001"],"element_type":"sky primordial","source_ids":[],"evidence_ids":[],"notes":"Recorded for comparison with other earth-sky cosmological structures."}