{"id":"COS-EGY-001","type":"cosmology","title":"Nun","status":"active","version":"1.0.0","tradition":"Heliopolitan Egyptian creation tradition","description":"Nun represents the primordial watery condition from which the creator emerges in the Heliopolitan tradition.","text_ids":["TXT-EGY-001"],"civilization_ids":["CIV-EGY-001"],"region_ids":["REG-NIL-001"],"element_type":"primordial waters","source_ids":[],"evidence_ids":[],"notes":"Egyptian creation traditions vary by center and period."}