{"id":"COS-MES-001","type":"cosmology","title":"Apsu","status":"active","version":"1.0.0","tradition":"Babylonian Enuma Elish","description":"Apsu is the male freshwater principle in the opening cosmological generation of Enuma Elish.","text_ids":["TXT-MES-001"],"civilization_ids":["CIV-MES-001"],"region_ids":["REG-MES-001"],"element_type":"freshwater deity/principle","source_ids":[],"evidence_ids":[],"notes":"Recorded as a feature of Enuma Elish specifically."}